{
  "schemaVersion": 1,
  "workflowVersion": 2,
  "tool": "vnext-verify.mjs",
  "mode": "enforced",
  "assuranceMode": "autonomous",
  "evidenceTrust": "cli-attested",
  "runId": "evidence-20260916050717-253c5a75",
  "generatedAt": "2026-09-16T05:07:23.141Z",
  "projectId": "TR-02386",
  "level": "V2",
  "status": "passed",
  "ok": true,
  "workItemFingerprint": "fdb73993e9e15f656dca1ad360bdda2b52859c056cc9ab0f89fac52692cd8099",
  "codeFingerprint": {
    "headSha": "054af824fab214851501c2d6c6104a5dfdeae8be",
    "baseSha": "054af824fab214851501c2d6c6104a5dfdeae8be",
    "contentHash": "cda3f8cb4bfe7ada0837850ca60b88941ac3074d29f536054a31f8b445e56ffe",
    "dirtyHash": "62384455e8ae8416e4d5e4688b80c7d7c0157b132732561ec9b9b3877c39b59f",
    "dirtyFileCount": 151,
    "untrackedFileCount": 0,
    "isGitRepo": true,
    "scopeMode": "path-set-v1",
    "scopePaths": [
      ".gitignore",
      "apps/web-next/.scratch/auth-web-next-migration/PLAN.md",
      "apps/web-next/.scratch/auth-web-next-migration/evidence-latest.json",
      "apps/web-next/.scratch/auth-web-next-migration/tr-02386-path-map.json",
      "apps/web-next/.scratch/auth-web-next-migration/tr-02386-surfaces.json",
      "apps/web-next/docs/page-migration.md",
      "apps/web-next/public/static/bind_mail_dark.svg",
      "apps/web-next/public/static/bind_mail_light.svg",
      "apps/web-next/public/static/public_successful.svg",
      "apps/web-next/public/static/register_v2_left_d.webp",
      "apps/web-next/public/static/register_v2_left_l.webp",
      "apps/web-next/public/static/scan_code_cn.webp",
      "apps/web-next/public/static/scan_code_en.webp",
      "apps/web-next/scripts/dom-contract/tr-02386/create-password.mjs",
      "apps/web-next/scripts/dom-contract/tr-02386/header-entry.mjs",
      "apps/web-next/scripts/dom-contract/tr-02386/i18n-keys.mjs",
      "apps/web-next/scripts/dom-contract/tr-02386/lib.mjs",
      "apps/web-next/scripts/dom-contract/tr-02386/login-page.mjs",
      "apps/web-next/scripts/dom-contract/tr-02386/mail-binder.mjs",
      "apps/web-next/scripts/dom-contract/tr-02386/page-migration-doc.mjs",
      "apps/web-next/scripts/dom-contract/tr-02386/register-page.mjs",
      "apps/web-next/scripts/dom-contract/tr-02386/scan-code.mjs",
      "apps/web-next/scripts/dom-contract/tr-02386/ssr-auth-boundary.mjs",
      "apps/web-next/scripts/dom-contract/tr-02386/third-fixes.mjs",
      "apps/web-next/scripts/dom-contract/tr-02386/third-reg-create.mjs",
      "apps/web-next/scripts/dom-contract/tr-02386/third-unite.mjs",
      "apps/web-next/scripts/dom-contract/tr-02386/verify-loop.mjs",
      "apps/web-next/scripts/e2e/tr-02386/header-nav.mjs",
      "apps/web-next/scripts/e2e/tr-02386/lib.mjs",
      "apps/web-next/scripts/e2e/tr-02386/locale-responsive.mjs",
      "apps/web-next/scripts/e2e/tr-02386/login-flow.mjs",
      "apps/web-next/scripts/e2e/tr-02386/login-state-propagation.mjs",
      "apps/web-next/scripts/e2e/tr-02386/register-completion.mjs",
      "apps/web-next/scripts/e2e/tr-02386/register-flow.mjs",
      "apps/web-next/scripts/e2e/tr-02386/scan-code.mjs",
      "apps/web-next/scripts/e2e/tr-02386/third-reg.mjs",
      "apps/web-next/scripts/e2e/tr-02386/third-sdk-overlay.mjs",
      "apps/web-next/scripts/e2e/tr-02386/third-unite.mjs",
      "apps/web-next/scripts/quality/tr-02386/component-size.mjs",
      "apps/web-next/src/apps/Home/components/FafaAndAnniversaryBanner/HomeSocialLinks.tsx",
      "apps/web-next/src/apps/Login/InputAccount.tsx",
      "apps/web-next/src/apps/Login/LoginForm.tsx",
      "apps/web-next/src/apps/Login/ScanCode.tsx",
      "apps/web-next/src/apps/Login/common/loginSearchParams.ts",
      "apps/web-next/src/apps/Login/common/test/authPayloads.test.ts",
      "apps/web-next/src/apps/Login/common/test/loginSearchParams.test.ts",
      "apps/web-next/src/apps/Login/index.tsx",
      "apps/web-next/src/apps/Login/shared/loginPayload.ts",
      "apps/web-next/src/apps/Login/shared/qrLoginStatus.ts",
      "apps/web-next/src/apps/Login/shared/test/loginPayload.test.ts",
      "apps/web-next/src/apps/Register/CreateAccount.tsx",
      "apps/web-next/src/apps/Register/CreatePassword.tsx",
      "apps/web-next/src/apps/Register/RegisterForm.tsx",
      "apps/web-next/src/apps/Register/common/registerSearchParams.ts",
      "apps/web-next/src/apps/Register/index.tsx",
      "apps/web-next/src/apps/Register/shared/registerPayload.ts",
      "apps/web-next/src/apps/Register/shared/test/registerPayload.test.ts",
      "apps/web-next/src/apps/shared/auth/hichatGrantToken.ts",
      "apps/web-next/src/apps/shared/auth/resolveAuthEntryUrl.ts",
      "apps/web-next/src/apps/shared/auth/test/authEntryFlag.test.ts",
      "apps/web-next/src/apps/shared/auth/test/authTrackingEvents.test.ts",
      "apps/web-next/src/apps/shared/auth/test/useThirdAuth.test.ts",
      "apps/web-next/src/apps/shared/auth/useAuthNavigationUrl.ts",
      "apps/web-next/src/apps/shared/auth/useCode.ts",
      "apps/web-next/src/apps/shared/auth/useRedirectIfLogin.ts",
      "apps/web-next/src/apps/shared/components/main-header/account/HeaderAccount.tsx",
      "apps/web-next/src/apps/shared/components/main-header/account/test/HeaderAccount.test.tsx",
      "apps/web-next/src/apps/shared/components/main-header/mobile/MobileHeaderMenu.tsx",
      "apps/web-next/src/apps/shared/format/formatSecondsToReadableTime.ts",
      "apps/web-next/src/components/CodeVerifyDialog/index.tsx",
      "apps/web-next/src/components/CodeVerifyDialog/verificationTypes.ts",
      "apps/web-next/src/components/MailBinder/index.tsx",
      "apps/web-next/src/components/MailBinder/store.ts",
      "apps/web-next/src/components/PasswordInput.tsx",
      "apps/web-next/src/components/PasswordRuleChecklist/index.tsx",
      "apps/web-next/src/components/PasswordRuleChecklist/passwordRules.ts",
      "apps/web-next/src/components/PasswordRuleChecklist/test/passwordRules.test.ts",
      "apps/web-next/src/components/ThirdPartyLogin/LoginOperateModal/CreateByThird.tsx",
      "apps/web-next/src/components/ThirdPartyLogin/LoginOperateModal/RegByThird.tsx",
      "apps/web-next/src/components/ThirdPartyLogin/LoginOperateModal/UniteByThird.tsx",
      "apps/web-next/src/components/ThirdPartyLogin/ThirdPartyBtns.tsx",
      "apps/web-next/src/components/ThirdPartyLogin/ThirdPartyIcon.tsx",
      "apps/web-next/src/components/ThirdPartyLogin/common/thirdAuthResult.ts",
      "apps/web-next/src/components/ThirdPartyLogin/index.tsx",
      "apps/web-next/src/components/ThirdPartyLogin/useThirdAuth.ts",
      "apps/web-next/src/components/VerifyInputs/index.tsx",
      "apps/web-next/src/components/VerifyInputs/store.ts",
      "apps/web-next/src/components/VerifyInputs/test/store.test.ts",
      "apps/web-next/src/components/VerifyInputs/test/verifyInputsStore.test.ts",
      "apps/web-next/src/components/VerifyMan/index.tsx",
      "apps/web-next/src/constants/regex.ts",
      "apps/web-next/src/i18n/core/namespaces.ts",
      "apps/web-next/src/i18n/i18next.d.ts",
      "apps/web-next/src/i18n/resources/zh-CN/common.json",
      "apps/web-next/src/i18n/resources/zh-CN/register.json",
      "apps/web-next/src/i18n/resources/zh-CN/thirdLogin.json",
      "apps/web-next/src/platform/captcha/test/geetestModalOverlay.test.ts",
      "apps/web-next/src/platform/domain/shared/ResilientArray.ts",
      "apps/web-next/src/platform/domain/shared/test/resilientCollection.test.ts",
      "apps/web-next/src/platform/domain/web/WebHttpApi.ts",
      "apps/web-next/src/platform/domain/web/endpoints/getLoginQrcodeIdEndpoint.ts",
      "apps/web-next/src/platform/domain/web/endpoints/getLoginQrcodeStatusEndpoint.ts",
      "apps/web-next/src/platform/domain/web/endpoints/getValidateSwitchEndpoint.ts",
      "apps/web-next/src/platform/domain/web/endpoints/loginInEndpoint.ts",
      "apps/web-next/src/platform/domain/web/endpoints/regEmailChkInfoEndpoint.ts",
      "apps/web-next/src/platform/domain/web/endpoints/regEmailConfirmEndpoint.ts",
      "apps/web-next/src/platform/domain/web/endpoints/regMobileChkInfoEndpoint.ts",
      "apps/web-next/src/platform/domain/web/endpoints/regMobileConfirmEndpoint.ts",
      "apps/web-next/src/platform/domain/web/endpoints/setEmailPasswordEndpoint.ts",
      "apps/web-next/src/platform/domain/web/endpoints/setMobilePasswordEndpoint.ts",
      "apps/web-next/src/platform/domain/web/endpoints/test/authLoginContract.test.ts",
      "apps/web-next/src/platform/domain/web/endpoints/test/authRegisterContract.test.ts",
      "apps/web-next/src/platform/domain/web/endpoints/test/qrLoginContract.test.ts",
      "apps/web-next/src/platform/domain/web/endpoints/test/thirdAuthContract.test.ts",
      "apps/web-next/src/platform/domain/web/schema/registerSchemas.ts",
      "apps/web-next/src/platform/domain/web/schema/test/futuresOrderCommandSchemas.test.ts",
      "apps/web-next/src/platform/third-party-sdk/googleSdk.ts",
      "apps/web-next/src/routeTree.gen.ts",
      "apps/web-next/src/routes/(auth)/login.tsx",
      "apps/web-next/src/routes/(auth)/register.tsx",
      "apps/web-next/src/routes/(auth)/route.tsx",
      "apps/web-next/src/routes/(main)/(with-footer)/index.tsx",
      "apps/web-next/src/routes/(main)/route.tsx",
      "apps/web-next/src/services/hooks/auth/authLoginMutation.ts",
      "apps/web-next/src/services/hooks/auth/authRegisterMutation.ts",
      "apps/web-next/src/services/hooks/auth/checkAccountMutation.ts",
      "apps/web-next/src/services/hooks/auth/confirmLoginMutation.ts",
      "apps/web-next/src/services/hooks/auth/hichatBindExistingAccountMutation.ts",
      "apps/web-next/src/services/hooks/auth/hichatRegisterAndBindMutation.ts",
      "apps/web-next/src/services/hooks/auth/joinAddAccountMutation.ts",
      "apps/web-next/src/services/hooks/auth/loginInMutation.ts",
      "apps/web-next/src/services/hooks/auth/loginQrcodeIdQuery.ts",